author_age,author_sex,title,text_date,sentence,sentence_summary
28,F,오늘의 일기,20200000,"올해 서른이 되었다. 나는 내 나이에 대해 별 다른 생각이 없다. 그저 한살 더 먹었구나, 이런 생각뿐인데 주변의 친인척들이 ""올해는 졸업해야지"", ""학교만 몇년을 다니는 거니"", ""또 학교 다닐건 아니지"" 등 걱정을 빙자한 잔소리를 하고 있다. 마치 내가 스무살때부터 현재까지 근 10년간 대학을 다니고 부모님에게 금전적 지원을 받은 것처럼 말이다. 하지만 스무살부터 현재까지 등록금과 생활비 충당은 내가 했고, 첫 번째 대학교 졸업 후 일을 하다가 현재 다니고 있는 학교에 입학했다. 독립한 것도 아니면서 집에서 알게모르게 지원 받은건 생각 안 하냐는 질문을 받으면 할 말 없지만 그래도 억울한건 어쩔 수 없는 일이다. 처음 한두번 저 소리를 들었을땐 웃어 넘겼지만 만날 때마다 저 말을 들으니 짜증이 난다. 한두살 먹은 어린애도 아니고 학교 졸업으로 걱정을 하다니 내 나이가 서른인데 앞가림 정도는 알아서 하지 않을까요?라는 말이 목구멍까지 차오르지만 애써 참아본다. 뭐 고민이 없는 것은 아니다. 학교 재학 중에 임용고시에 합격할 수 있을지, 임상으로 진로를 변경해야 할 지, 차라리 합격 확률이 높은 소방임용 준비를 할 지 같은 고민이 매 번 머릿속을 맴돈다. 불확실한 미래의 큰 갈림길에서 선택을 해야할 때 매 번하는 고민이다. 내 상황에 할 수 있는가? 위험성이 얼마나 되지? 합격 가능성이 가장 높은 것은 무엇인가? 같은 것들을 항상 생각한다.  여유롭지 못한 환경으로 가장 최선이 아닌 내가 할 수 있는 최선을 고르게 된다. 지원을 기대할 수 없고 혼자 해나가야 하는 상황에 대해 비관하거나 부모님 탓을 하진 않는다. 그저 가끔 이런 선택을 해야할 때가 오면 조금 울적한 기분이 든다. 가장 최선의 것을 포기해야 한다는게 아직도 익숙하지 않나보다. 그래도 현재 상황이 어렵다면 어려운 상황을 해결하고 다음 일을 하면 되는 게 아닐까하고 생각해본다. 오늘도 그런 선택을 한 날 중 하나이다. 좀 울적하지만 털어버리고 앞으로 나아가야지. 나는 오늘도 잘 했고 내일도 잘 할 것이다.",올해 서른이 된 나는 주변의 친인척들이 걱정을 빙자한 잔소리를 하고 있다. 내가 20살때부터 근 10년간 대학 다니고 부모님에게 금전적 지원 받은 것처럼 생각하지만 학교 재학 중 임용고시에 합격할 수 있을지 임상으로 진로 변경해야 할지 아니면 소방임용 준비 등 매 번 하는 고민이다.
12,F,가족이란 단어는 내게 어떤 인상인가,20130000,가족. 그냥 가만가만 눈을 감고 꼬옥 껴안고 잠에 들 수 있으면 그것만으로도 좋겠지. 그랬으면 좋겠다.,핵심 내용 요약 가족. 눈을 감고 꼭 껴안고 잠에 들 수 있으면 그것만으로도 좋겠지 그랬으면 좋겠다.
21,F,2019년 동생과 일본여행 ,20200000,"3월 11일 오전 6시. 이른 새벽에 집을 나섰다. 동생과 전날 밤부터 여행을 갈 것이라는 설레임에 잠을 설쳤다. 새벽 4시부터는 거의 깨어 있었다. 다행히도 아빠가 공항까지 데려다 주신다고 해 편하게 공항까지 갈 수 있었다. 공항에 도착한 후 미리 구매했던 라피트 탑승 교환권과 인터넷을 사용하기 위한 포켓와이파이를 수령했다. 두 개의 캐리어를 부치고 탑승 수속을 했다. 3월이라 이미 개학한 후라 사람이 많이 없을 거라고 생각했는데, 생각보다 공항에 사람이 많았다. 비행기에서는 잠만 잤다. 눈을 뜨고 보니 일본 간사이 공항이었다. 공항에서 라피트 교환권을 탑승권으로 바꿨다. 라피트를 타고 난바역으로 갔다. 역에서 숙소까지는 얼마 걸리지 않았다. 구글맵을 이용했는데, 동생이 길을 잘 찾아 든든했다. 숙소에 들어가 짐을 풀고 잠시 쉰 뒤 도톤보리를 구경하기 위해 걸어서 이동했다. 숙소에서 도톤보리는 매우 가까웠다. 도톤보리를 구경한 후 초밥을 먹었다. 생각보다 시간이 너무 늦어져 급하게 지하철을 타고 하루카스 전망대로 갔다. 다음날 유니버셜 스튜디오에 빨리 입장할 수 있는 스페셜 엔트리 티켓을 받기 위해서였다. 한국 사람이 정말 많았다. 우리 앞에서 줄을 서 있던 한 커플이 수건을 공짜로 받을 수 있는 행사가 있다고 알려주었다. 감사를 표하고 수건을 받았다. 전망대는 생각했던 것보다 100배는 더 멋졌다. 높은 곳을 별로 선호하지 않는데, 그럼에도 너무나 아름다웠다. 한참을 멍하니 오사카 시내를 내려다보다가 저녁식사를 하러 갔다. 저녁을 먹고 숙소 근처 편의점에 들러서 저녁에 먹을 야식을 골랐다. 일본 편의점에는 정말 맛있어 보이는 것들이 많았다. 유튜브를 보고 먹고 싶었던 찰떡 아이스크림과 포도맛 아이스크림을 골랐고, 어묵과 음료수, 물도 구매했다. 생각보다 배가 덜 고파서 아쉬웠다. 숙소로 돌아와 깨끗히 씻고 냉장고에 넣어뒀던 아이스크림을 꺼냈다. 냉장고 성능이 생각보다 좋지 않아 꽝꽝 얼어 있지는 않았지만, 아이스크림은 정말 맛있었다. 부모님과 전화통화를 한 후 내일의 계획을 정리했다. 내일은 그토록 기대했던 유니버셜 스튜디오에 가는 날이라, 일찍 잠에 들기로 했다. 여행 첫날인데 동생과 큰 마찰 없이 하루를 보내서 다행이라고 생각했다. 내일이 기대된다.",유니버셜 스튜디오에 빨리 입장할 수 있는 스페셜 엔트리 티켓을 받기 위해 오사카 시내를 내려다보다가 숙소 근처 편의점에서 저녁 간식으로 먹을 것들을 샀다. 생각보다 배가 덜 고파서 아쉬웠다.
24,F,예전 일기,20200000,"2015.01.12 오늘 관쌤에게 무척 혼났다. 내가 왜 그렇게 혼이 났었는지도 모르겠다. 맞은편 건대실기 시험보는 애들 봐주다가 열을 받았던 걸까. 그걸 내가 조금 잘못한걸로 풀어버리는 것 같았다. 내가 내 그림을 못 챙긴건 정말 잘못했지만, 이건 도가 넘었다.  그렇게 심한 욕을 들을 이유가 있을까? 그래도 오늘이 학원 마지막 날이라서 다행이다. <name1>의 얼굴을 보지 않아도 되서 좋다. 2015.02.04 무턱대고 반수 한다고 서울에 올라갔었지만 결국 다시 다니던 학교를 다니게 되었다. 엄마는 날 부끄럽다고 생각하고 있는거겠지. 할 일도 없고 빈둥대기만 하는 내가 너무 보잘것 없어 눈물이 난다. 하루하루 시간은 잘 가지도 않고 말 그대로 잉여 그 자체. 눈치보는게 싫어서 괜한 자존심에 엄마에게 신경질 부린다. 이제 집에서 내 어리광을 받아줄 사람은 엄마 뿐이다. 아직도 나를 애기로 보고있는것 같으면서도 어쩔때는 진작 철들어서 자기 앞가림 하는 애로도 보이나 보다. 엄마가 보고있는 내가 너무 많아서 어떻게 맞춰줘야 할지 모르겠다 2015.02.05 '네가 한게 뭐가 있냐'는 말을 들었다. 돈 들이게 하는게 미안해서 광주학원에서 알바하며 버는 돈으로 서울다니는 버스비를 했고, 서울에서 무료로 배우는 대신 전주가서 알바하는 일까지 했다. 일주일을 그렇게 반년을 열심히 했는데 그렇게 노력했는데... 관쌤의 조롱어린 말도 참아가며 그렸다. 그런데 그런식으로 나를 깎아 내리는 말을 하다니, 너무 억울하다. 과정은 중요하지 않지? 결과만 보지",2015.01.12 오늘 관쌤에게 무척 혼났다. 옆 건대실기 시험보는 애들 봐주다가 열을 받았던 걸 내가 조금 잘못한 걸로 풀어버리는 것 같았다.
19,F,2020년 02월 06일,20200000,"아무런 나의 생각들을 나열해 보는 글이 될 것 같다. 지금은 대학교 방학이다. 다른 친구들은 여럿 활동들도 하고, 이곳 저곳 여행도 가고,  방학을 나름 의미 있게 보내고 있는 것 같다. 그런데 나는 다른 친구들과 다르게 그냥 하루하루를 허비해 보면서 살아가는 것 같다. 평일에는 오전 알바를 다녀오고 너무 피곤해서 자고, 저녁을 먹고 잠드는게 내 평일의 일상이다. 주말이라고 크게 다르지 않다.  주말에는 저녁 알바를 가기 때문에 오전시간에는 잠을 자고, 밥을 먹고 준비하고 알바에 다녀온다. 사실 이러면 많은 돈을 벌고 있는 것 같지만 알바를 하는 시간이 길지 않아서 많은 돈을 벌지는 못한다. 나는 돈에 대한 욕심이 있다. 누구나 돈이라면 많이 가지고 싶은 그런 욕심이 말이다. 나는 그런 욕심을 가지고 있다. 내가 가지고 싶은 것을 다 가지고 싶고, 맛있는 음식도 언제나 먹고 싶고, 이쁜 옷, 악세사리, 전자 기기등을 다 가지고 싶다. 이세상에는 내가 가지고 싶은 물질적인 것들이 많이 있다. 그런 것들을 다 가지려면 많은 돈이 필요하다. 그래서 돈을 벌기 위해 알바와 직업을 얻고 돈을 번다. 이러다 보면 이상한 부분이 있다. 휴식을 취하면서 내가 가지고 싶은 것들을 다 가지기 위해서는 내가 태어날 때 부터 많은 돈을 가지고 있어야지만 가능한 일이다.  태어날 때 부터 많은 돈을 가지고 있지 않은 사람들은 돈을 내 손에 얻기 위해 평생을 일을 하며 보낸다. 나는 참 이런게 이상하다. 나는 그냥 편하게 살고 싶을 뿐인데 편하게 살기 위해서는 무조건 돈이  필요한 세상에서 살고 있다니 그 돈을 벌기 위해서는 내가 언제나 일을 해야한다니 참으로 슬픈일이다.  인간은 점점 커가면 커갈 수록 돈이 더 많이 필요하게 된다.  돈이란 양면성을 가지는 아이같다. 언제는 좋다가도 또 언제는 증오하고, 싸우는 그런 양면성을 가진 아이 이다. 아무런 생각  없이 나의 생각을 쓰는 그런 일기를 쓸 생각이였는데 글의 대부분의 내용이 돈에 관련된 내용을 쓴 것 같다. 사실 곧있으면 대학교 등록금이 나갈 시기라서 돈에 대한 생각이 더 많이 하는 것 같다. 자유롭게 글을 쓰는게 얼마만인지 새롭게 다가오는것 같다. 무척이나 재미 있는 것 같다. 앞으로 종종 글을 써볼 것이다.",나는 돈에 대한 욕심이 있고 누구나 가지고 싶은 물질적인 것들을 다 가지기 위해서는 많은 금전을 가져야만 가능한 일이다. 인간은 점점 커갈 수록 더 많이 필요하게 된다.
21,F,꿈이야기(인간과곤충),20200000,"얼마전에 꿈을 꿨다. 나는 지금 대학생이지만, 꿈에선  고등학교 배경이였고 교복을 입고 수업을 듣고 있었는데 갑자기 어떤애가 으아아악 소리를 질러서 그쪽을 봤더니 바닥에 바퀴벌레랑 잠자리가 섞인듯한 모습을 하고있는 벌레가 한 마리 기어다녀서 발로 밟아 죽인 뒤 수업이 다시 정상적으로 시작이 됐는데 그 한 마리를 계기로 똑같이 생긴 여러 크기의 그 벌레들이 교실 바닥이며 벽 그리고 천장에까지 기어다녀서 교실안이 혼미백산이 되서 나랑 반 아이들 그리고 선생님이 교실 밖으로 뛰쳐나갔는데 밖은 이미 난리가 나서 비명소리와 함께 애들이 뛰어다녔고 엄청 크고 긴 구렁이 몸에 사람 얼굴을 한 여자가 계단에서 스르륵 내랴오면서 애들을 잡아먹고 있었다. 나는 그 모습을 숨어서 멍을 때리며 지켜보고 있었는데 이 알 수 없는 이상한 상황과 저 구렁이여자를 잘 아는듯한 중년남자가 계단을 다급하게 올라오더니 나랑 눈이 마주치다마자 내 팔을 잡고 막 뛰기 시작했다. 그래서 구렁이여자가 나와 아저씨를 발견했고 몸을 스르륵 빠르게 움직이며 우리를 쫓아왔다. (애초에 이 아저씨 아니였으면 난 들키지도 않았을텐데 도망을 쳐도 왜 눈에띄게 대놓고 도망쳐서 들키지...) 학교 전층을 한바퀴 돌면서 추격전을 했는데 나랑 아저씨는 넘어지고 피나고 땀흘리고 난리를 치면서 도망쳤지만 그 구렁이 여자는 멋있게 창문밖이랑 복도를 왔다 갔다 하면서 쫓아왔다 그렇게 꼭대기 층을 찍고 다시 아래로 내려오는데 3층 쯤에서 아저씨가 갑자기 이 학교는 이미 늦었다면서 자기 혼자 창문에서 뛰어내려 도망을 쳤다. 난 진짜 화가나서 욕을하며 1층으로 달려내려갔고 나와서 운동장쪽으로 갔더니 이미 애들이 많이 모여있었다. 하지만 내가 도착한 순간 구렁이 여자가 창문에서 나와 벽을 타고 내려오더니 날 보고 씨익 웃었는데 바로 눈앞이 암전되었다. 그리고선 3인칭으로 다시 앞이 보이더니 나와 애들이 교실에서 무엇인가 하고 있었는데 그 구렁이 여자가 우리에게 무슨 짓을 한거같았다. 우린 각자 곤충의 특성을 가지게 되었고 교실 안에 시험보는것처럼 한 자리씩 띄엄띄엄 대형이 짜여져 있었으며 의자에 앉아 각자의 책상 위에 가상현실4d시뮬레이션 처럼 어떠한 상황이 연출되면 자신이 가지고 있는 곤충의 특성을 활용하는 훈련을 하고있었다. 나는 거미의 특성을 가지고 있었고 내 옆 친구는 개미 이런식이었다. 그리고 꿈에서 깼다. 깨고나서 생각해보니 곤충의 특성을 활용하는 훈련을 모두 마치고 익숙해지면 그 구렁이여자처럼 변하는게 아닐까 했다. 자기전에 괴담을 많이 보고잤더니 이런 꿈을 꾼것같다.",나는 고등학교 배경의 꿈을 꿨는데 바닥에 바퀴벌레와 잠자리가 섞인듯한 벌레 한 마리를 계기로 똑같이 생긴 여러 크기 곤충들이 기어다녀 혼미백산이 되어 선생님이 교실 밖으로 뛰쳐나갔다. 그런데 3층 쯤에서 나타난 구렁이 여자는 우리에게 무슨 짓이냐며 날 보고 씨익 웃었는데 바로 눈앞이암전되었다.
20,F,이틀간의 일기,20200000,"이번 생일은 평소와 같은 날처럼 소소하게 보내려고 했는데 생각한 것보다 눈이 일찍 감겼고 그 때문인지 이른 아침에 일어났다 새벽부터 둘도 없는 (사실은 딱 둘이지만) 친구들에게 축하도 받고 자고 일어나니 선물도 받게 되어서 기분이 무지 좋았지 드림캐쳐 선물받은 건 처음인데 일부러 내 생각 해서 분위기와 맞는 걸로 보내 준 것 같아 마음 한 켠이 찡하기도 했다 오후에는 그래도 깨끗한 방에서 기분 좋게 있고 싶어 일찍 청소를 마무리하고 쓰레기까지 버리고, 치즈 돈카츠를 먹으러 가려 했는데 도착하니 마감 시간이라서 결국 못 먹고 할머니댁에 들렀다 그런데 할머니가 생일이라고 미역국을 미리 만들어 두신 거야... 사골국에 고기 듬뿍 넣어 많이도 하셨더라 너무 맛있게 잘 먹어서 칼로리 걱정은 안 했다 새 카드 발급 받으러 농협에 갔는데 라이언 신상 카드가 나와서 그걸로 발급도 받고, 엄마가 주택청약 통장도 개설해 주어서 가입일이 내 생일로 찍혔다 오후엔 엄마 회사에서 조금 눈 붙이다가 퇴근길에 드라이클리닝 맡겨 두었던 이불 챙기고 저녁 식사 후에 주짓수 다녀와서 씻었더니 하루를 알차게 보낸 것 같아 기분이 매우 좋았다! 보송보송 새 이불과 함께 좋아하는 asmr 들으면서 꿈나라 여행~ 꿀잠 자긴 했는데 몸이 찌뿌둥해서 눈이 조금 늦게 뜨였다 대충 준비하고 학원에 먼저 들러 한 시간 정도 공부를 하고 보건소에서 신청해 두었던 보건증도 가져왔다 그리고 예상 플랜에서는 알바 하는 데를 우선 들렀어야 하는데 타이밍이 안 맞아서 버스도 계속 놓치고... 추운 날 밖에서 한 시간은 앉아 있었던 것 같아 동두천까지는 버스 타고 지행은 지하철로 갈아타서 갔다 치과 들르기 전 간단히 식사를 하려고 빽다방에서 아아메와 소시지빵을 먹으려다 광고로 본 양송이스프가 눈에 아른거려서 홀린듯이 시켰다 다섯 입 정도까지는 맛있는데... 버섯을 그렇게 좋아하는 편은 아니라 그런지 물렸고 소시지빵은 너무너무 맛있었어 칼로리가 생각보다 높았는데 그래도 후회는 없다... 왜냐하면 치과 가기 전 내 마음 달래 주려는 거였으니까 스케일링만 하려다가 앞니 관련 치료도 받게 되어서 신경 치료까지 받았다 돈이 꽤 깨지겠지만... 한두 달만 치료받고 나면 건강한 치아로 될 테니 알바 열심히 해야지 오늘도 주짓수 사람 엄청 많았음 서른 명 가까이 됐는데 재미있게 운동하고 샤워하고 늦지 않게 잠에 들었다",이번 생일은 평소와 같은 날처럼 소소하게 보내려고 했는데 생각한 것보다 눈이 일찍 감겼고 그 때문인지 이른 아침에 일어났다 친구들에게 축하도 받고 자고 일어나니 드림캐쳐 선물을 받게 되어서 기분이 무지 좋았다 오전에는 청소를 마무리하고 쓰레기까지 버리고 저녁 식사 후 주짓수 가서 씻었더니 하루가 알차게 보낸 듯 했다 치과 들르기 전 간단하게 먹기 위해 빽다방에서
21,F,지금,20200000,"수능 입시라는 큰 산을 하나 넘고, 꽤 괜찮은 대학교의 학생이 되었음에도 우리나라에서 취직을 하기는 쉽지 않다.  1학년 때까지만 하더라도 사회생활과 대학교 졸업 후의 일을 생각하지 않고 놀 수 있었는데, 어느새 3학년이 끝났고 벌써 취직 준비를 시작할 때가 되었다. 회계사라는 목표를 잡고 공부를 시작한지 벌써 한달이 다 되어가지만 공부는 여전히 하기 싫고ㅠ 독서실에서 앉아있는 건 너무 힘들다. 이걸 적어도 3년은 해야한다니... 그래도 힘내자!! 진짜 열심히 해서 단기간안에 수험생활을 끝내고, 시험에 합격하기만 하면 취직에 대한 걱정 없이 놀수있어. 시험이 끝나면 드럼학원도 다니고, 영어학원도 다녀야겠다. 영어는 진짜 열심히 해서 실력을 향상시키고 싶어.  그리고 공부를 할 수 밖에 없는 요인이 하나 더 있다. <name1>!! 같이 시험공부 시작했는데 그 친구만 되고 나는 안되면 얼마나 짜증나, 그리고 <name1>은 원래 공부 진짜 열심히 하잖아. 하기 싫어도 꾹 참고 열심히 하다보면 좋은 결과가 있을 거고, 그럼 가족들한테도 떳떳해질 수 있어. 화이팅!!",수능 입시라는 큰 산을 넘고 꽤 괜찮은 대학교의 학생이 되었음에도 우리나라에서 취직하기는 쉽지 않다. 1학년 때까지만 해도 사회생활과 대학 졸업 후를 생각하지 않고 놀 수 있었는데 어느새 3학년이
31,F,엄마가 되고 나서,20200000,2018년 10월 우리 부부에게도 소중한 아이가 찾아왔다. 임신만 되면 출산은 아무것도 아닐 줄 알았는데 임신 10개월동안 입덧에 배뭉침에 다리저림 등등 생각보다 너무 힘들었다. 한 2~3개월만 임신하고 낳으면 안되나. 왜 자연은 이렇게 긴 시간동안 아이를 품게 했을까..같은 의미없는 원망도 하며 드디어 2019년 6월 천사같은 소중한 딸아이가 세상에 태어났다 처음본 딸의 모습은 기쁨과 환희와는 조금 거리가 멀었다. 약간 낯선 모습의 아기. 니가 정말 내 뱃속에 있던 생명체 맞니? 아기가 내 자궁에서 나와 처음 눈을 마주쳤을때 내 첫마디는 '너였구나!'였다. 그래 우리도 서로 정들고 익숙해질 시간이 필요하겠지 싶었다. 출산으로 퉁퉁 부은 몸을 겨우 추스르고 첫 수유시간은 당황스러움 그 자체였다. 나는 고상한 인간인줄 알았는데 처음보는 간호사 잎에서 젖가슴을 내놓고 수유자세를 배우는 내 모습이란! 결국 인간도 동물이구나...지금껏 미적인 용도로만 생각하던 내 가슴이 드디어 원초적인 용도로 활용되던 그 순간은 그닥 유쾌하지만은 않았다 눈도 뜨지 못한 아가에게 어설프게 젖을 물리자 아가는 입을 오물오물거렸지만 젖이 펑펑 솟을거란 내 예상과 달리 한방울도 나오지 않았고 아기는 자꾸 모유을 찾아 내가슴을 파고들었다. 아기 낳으면 바로 젖이 나오는줄 알았던 내가 얼마나 무지했는지. 그렇게 허망하게 첫 수유가 끝났다 임신부터 출산 육아에 이르는 기나긴 레이스를 준비하기 위해 많은 공부를 했지만 실전은 너무나 달랐고 정말 바보가 된 기분이었다. 그리고 새로 얻은 내 신분..엄마라는 호칭에.익숙해지기도 전에 당연하듯 산후우울증마저 찾아와 원투펀치를 맞고 넉다운된 패전선수가 된 것 같았다. 너덜너덜한 내 몸과 마음은 누가 달래주는지 외계인처럼 쪼글쪼글 퉁퉁 부은 아기가 예쁘고 사랑스럽다는 생각보다 내 주변을 둘러싼 모든것이 한꺼번에 변해 그야말로 정신없는 몇주가 그렇게 흘러갔다 밤에 잠을 자지 않고 3시간에 한번씩 젖을 찾는 아기가 때때로 너무 미웠고 그러면서도 내가 아니면 이렇게 작고 연약한 생명체를 누가.건사시키겠냐는 책임감에 버텨냈다,2018년 10월 우리 부부에게 소중한 아이가 찾아왔다. 출산으로 퉁퉁 부은 몸을 겨우 추스르고 첫 수유시간은 당황스러움 그 자체였고 아기 낳으면 바로 젖이 나오는 줄 알았던 내 무지함에 허무했다.
22,M,나의 하루.,20200000,요즘 너무 우울해 집에만 있던 나는 분위기를 전환겸 친구들과 약속을 잡았다. 아침에 일어나 약속시간 전까지 할 일이 있어 씻고 나갔는데 오랜만에 맞는 바깥공기에 기분이 그냥 좋아지는것 같았다. 그리고 요즘 바이러스때문에 중국 공장이 돌아가지않아 하늘도 맑고 그래도 빨리 바이러스는 사라졌으면 좋겠다. 오늘 쌀쌀한 날씨지만 따뜻하게 입고나와 다행이였다. 일 하나를 한시간 가량을소모하여 끝 마치고 스타일 변신을 하고싶어 어제 예약한 미용실로 발걸음을 향했다. 들어가자 마자 친절하게 맞아주는 미용사분들 한미용사 분이 나를 안내해 자리를 앉히고 무슨머리로 할지 물어보았다.  인터넷에 찾아보고 제일 괜찮았던 머리를 스크랩해논 것을 보여드렸다. 펌이름은 쉐도우펌 군입대전에 한 펌이후로 처음해보는 펌이였다. 그래서 걱정도 엄청 많이했다. 펌 전에 커트를 하는데 커트하면서도 이건 어떤지 저건어떤지 여기는 어떻게 해드릴건지 더잘라주는지 하나하나 꼼꼼히 나에게 물어보는 미용사분을 보니 머리가 망하지는 않을까 안어울리면 어쩌지라며 걱정을 많이했던 나는 거짓말 처럼 걱정이 싹 사라졌다. 커트가 끝나고 머리를 정성스럽게 말아주셨다. 다말아주신후 열로 지지고 나서 머리를 감겨주시고 머리에 대해 잘 모르는 나에게 머리말리는법을 알려주셨다. 가격은 비쌋지만 정성을 다해주시고 안심을 시켜주어서 아깝지 않은 돈이였다. 다끝난 후 시간을 보니 3시였다. 살짝 출출한데 밥먹기는 애매한 시간이라 우리는 pc방에 가 음식을시켜 먹으면서 게임을했다. 요즘 피씨방은 음식도 다양하고  괜히 pc토랑이라고 하는건 아닌 것 같다.  게임하던 도중에 시간이 저녁먹을시간이라 우리는 오랜만에 만나 술도 먹을겸 곱창집에 들어가 곱창전골과 술을 시켜서 뭐하고 지냇는지 서로의 근황도 물어보고 옛날얘기도 하고 쓸대없는 얘기도 하며 재밋게 먹으며놀다가 이대로가긴 아쉬워 당구장에가 2:2 4구 당구장 비용 내기를 했다. 거짓말처럼 4명이 다 못쳐 1판끝나는데만 1시간30분이걸렸다. 결과는 내가속한팀이 이겼다. 당구를 다치고 나와 노래방으로 향해 우리는 마지막 흥을 쏟아내고 12시가 돼서야 집으로갔다.,분위기 전환겸 친구들과 약속을 잡은 나는 오랜만에 맞는 바깥공기와 바이러스가 빨리 사라졌으면 좋겠다고 생각했다. 일 하나를 한시간 가량 소모하여 끝 마치고 스타일 변신이 하고싶어 예약한 미용실로 향했다.
