author_age,author_sex,title,text_date,sentence,sentence_summary
23,F,새벽일기,20190000,"어느 새벽밤  첫날 깊은 어둠이 하늘의 별까지 재우는 그런 새벽이 오면 겨우 울음을 터트렸다. 그동안 꾹꾹 눌러 참던것을 토해내듯 그렇게 울음을 쏟아내는 동안에는 세상이 잠들어 버린 뒤라서 아무도 몰랐다. 그래서 안심했고, 그래서 슬펐다. 아니 사실은 서러웠다. 나는 이렇게 슬픈데 왜 아무도 알아주질 않을까. 이렇게 달래주지도 않을꺼면 나를 슬프게 하면 안되는것 아닌가.하는 원망을 끊임없이 마주본 벽에게 되내겼다.그렇게 벽은 멍들어 갔다. 어느 새벽날 둘째날 달을 마주보는것이 좋았다. 그저 둥그렀다,반쪽이 되었다가 사라지는 단순한 행위를 반복하는 위성이지만 묘한 마성이 있다. 소원도 빌어봤다가 투정도 해봤다가 그냥 바라만 보았다. 유난히 큰 모습을 볼때면 마냥 좋았다. 어느새벽날 셋째날 한동안 밖에 나가지 않았을때는. 머리위로 쏟아지는 햇빛이 눈이부셔서 싫었다. 마치 뱀파이어처럼 햇빛이 나를 태우기라도 하는양 그밑으로 내려가면 기분이 나빴다. 미처 이런 밝은 빛에 적응하지 못한 눈이 쏟아지는  빛을 한껏 삼키다, 시려워했다. 시큰거리는 눈을 꾹 감았다가 뜨면서 나는 생각했다. 아, 이대로 타죽었으면. 어느새벽날 넷째날 뻔히 속이 보이는 속임수를 아무렇지도 않게 하는 너에게 나는 어디까지 너그러워야하는걸까 나는 너를 놓지 못할거라는 자만심인건지. 아니면 나를 바보로 보는건지 내가 알길이 없지만.이제는 조금 지친다. 결국 나는 견디지 못하고 뒤돌아 서버릴텐데.그때도 넌 아무말도 하지 않겠지. 미련이 한가득 산을 이룰지라도 나는 다시 돌아오지 않을꺼야. 그러면 안돼. 내 자존심이 너무 많이 긁혀서 안쓰러우니까. 어느새벽날 다섯째날 하고싶은말이 너무 많으면 그러면 어떡해 해야할까 내가 하고 싶은 말을 들어주는 사람이 없어서 주체할수 없을때가 종종있다. 간혈적으로 특히 새벽의 그여린시간에 찾아와 내 마음을 사정없이 난도질하는 날이면 어찌 해야할봐를 몰라서 그렇게 그냥 베개에 고개를 파뭍고 이감정이 빨리 지나가길 바라는 수밖에 없다. 어느새벽날 여섯째날 회색빛의 손한뼘이 조금 남은 직사각형의 판 그위에 먼지가 쌓이고 쌓이다 마스킹 테이프가 섬유방향제가 쌓여서 그 의미를 퇴색했다. 그저 있었다. 그자리에서 먼지를 가만뒤집어 쓰고 시선한줄받지 못한 그판은 그렇게 존재하되 존재하지 않게 되었다. 아, 저것은 월래 쓰임이 뭐더라 무심한 물건의 주인이 든 의문은 쉽게 답을 찾는다. 정말 몰라서 묻는게 아니였다. 왜 저것을 쓰지않느냐는 제 자신에 대한 물음이였으므로. 지금의 나는왜 저걸저렇게 방치를 하고있느냐고 저것은 태블릿이다. 그림을 그리는 직사각형의 판 처음에 저것은 생각보다 비싸서 사기까지 꽤나많은 고민을 거듭했다. 그때는 그랬다. 어렸고 돈은 많았으나 겁이 많고 의욕이 넘치던 시기 젊은날의 나 그래서 샀지. 사서 꽤나 부지런히 사용을 했다. 그랬는데 지금은 왜이렇게 그저 먼지를 뒤집어 쓰게 두냐는 나에 대한 원망이였다. 그래 나는 왜이리 되었나. 그저나는 젊은날의 나보다 조금늙고 돈이 없으며 게을렀다. 젊을때보다 나은것이라고 해봐야 일정한 휴일과 많은 시간이건만 지금의 나는 그 시간을 도무지 제대로 쓰질못했다. 그저먹고 살을찌웠다. 살이찌니 몸이 무거운지 점점더 밖을나가기 싫어지고 그렇게 그냥 시간을 죽였다. 힘들다는 핑계를 대면서 말이다. 그리고 나를힘들게 하는 이상황에서 도망칠 예정이였다. 그리고 내심 생각했다. 여기를 벗어나면 그러면 다괜찮을꺼라고. 이것이 사실인지 아니면 그저 이상황을 모면하고자 하는 나의 자위인지는 몰라도. 지금은 여길 벗어나고 싶었다. 후회하지않는 삶을 살기위해서 부던히도 노력했는데 나는 늘 후회하고 과거의 날을 탐하고있다. 현실에 만족을 못하고 이렇게 미련에 미련만 쌓여서 결국나는 글도안쓰고 그림도 안그리고 책도 읽지않고 나는 이렇게 도태되어 가고있다. 가지지도 않은 재능을 머릿속에 그리면서 마치 상상한것만으로도 그재능이 내것인양 착각에 빠져 아무것도 하지않고 자만해져 가다가는 그저나는 멍청한 인간이 될텐데 나는 결국 할수있는게 아무것도 없으면서 머릿속으로 상상하고 그것을 가졌다 착각하고 있다. 쓰이지못한 글들과 그려지지못한 그림들이 머릿속에서 그려지고 써졌다가 잔인하게 지워져 간다. 결국나는 그림도 글도 아무것도 완성하지못하고 부유물처럼 둥둥떠다니는 미완성들에 쌓여서 그렇게 아무것도 하지않고 그저 먼지를 뒤집어 쓰고 그저 존재하고 있었다. 어느 새벽날 일곱째 날 나는 네가 행복하지않았으면 좋겠어. 이기적이라고 해도 좋아 이게 이기적인거라면 그렇다면 좋아 나는 얼마든지 이기적인 사람이  되겠어. 그래서 너도 나를 주말밤에 생각하면 좋겠어 미련으로 후회로 더럽게 늪에 빠져버렸으면 좋겠어. 이건 저주가 아니야 내가 지금 그렇게 되어버렸으니 나는그저 너도 나랑 동등 했으면 좋겟어 . 그렇다고 다시 만남을 갖고싶은건아니야 나는 아마 니가 나를 만나고자 한다면 피해버릴꺼야 지금의 내 자신이 초라하거든 그리고 아마 너는 찬란하겠지 그래서 나를 만나고자 하는거겠지 너는 그런사람이니까 그래서 나는 네가 잘되지 않았으면 좋겠어 어느날밤 새벽에 이불에 파묻히면 문득 생각났으면 좋겠어 그래서 괴로워 했으면 해 나처럼 나는 더이상..너같은 사람이 나한테 안왔으면해 관계를 맺는게 무서워 이렇게 또 사라질까봐 무서워 그시작과 과정이 너무 좋았는데 하나같이 끝이 나빠 돌이킬수없는 이관계를 나는 더이상 시작하지않을꺼야 . 그렇지만 이렇게 고요한 새벽은 나를 너무 외롭게 해서 사람이 미친듯이 그리워서 어쩔수없는 날이 있어. 그래서 이럴때면 네가 생각나고 그립다가 다시 원망스러워. 나를 이렇게 만든 너가 그래서 나는 행복하지 않았으면 좋겠어. 어느 새벽날 여덟번째 날 그저 있고 싶다가 뭐라도 되고 싶다가 아무생각 없이 먹고 다먹고나서 후회하고 군중에서 피곤하고 혼자있으면 외롭고 슬프고 그저 모순이 가득한 삶 그렇게 살아가고 있습니다. 손이트고 얼굴이트고 입술이 트고 몸이 터서 가렵고 신경쓰이고 뭐든 스치면 따가운 계절 이 왔는데 저는 아무것도 하기가 싫습니다. 이불속에 가만히 있고싶은데 이불속에서도 민감한 이피부는 가렵다고 호소합니다. 결국 저는 아무곳에서도 편안하지 못하되 아무것도 하지않는 그런 하루를 보내고 있습니다. 일하기 싫은데 돈이 많고 싶고 아무도 만나기 싫은데 나를 찾아주면 좋겠습니다. 그저 모순입니다. 어느 새벽날 아홉번째 날 도망가자 그리고 돌아오지 말자 아무도 나를 알수없는곳에서 그저 웅크리고 있었으면 좋겠어 아무도 나를 모르는 곳에 가면 그러면 나는 외로울까 아무도 나를 찾지않고 나를 모르면 그러면 좀 편해질까 나는 누구에게 그렇게 잘보이려고 이렇게 아등바등 살아가는 걸까 가족도 친구도 무한한 내편이 될수 없는거 같아 그냥 내옆에 있어줄 사람이 필요해 나는 결혼도 안할거고 애도안낳을껀데 그런데 그거랑은 별개로 그냥 무한한 내편이 있었으면 좋겠어 그냥 그래",내가 하고 싶은 말을 들어주는 사람이 없어서 주체할 수 없을 때도 있다. 나는 지금 여기를 벗어나고 싶어서 노력했지만 현실에 만족하지 못하고 미련만 쌓여 도태되어 가고 있는 것이다.
19,F,2,20190000,"우울한 감정에 충실할 수 없다. 생각해보면 무척이나 슬픈 일이다. 내가 슬퍼할만한 일이란 무엇일까. 그것을 판단하는 감정을 미확인 생물체마냥 멀고 어렵고, 미지의 대상으로 느끼는 것이 내 우울의 근원일테다. 아니, 알수록 더 우울해질지도 모르겠다. 무언가를 들여다보는 일은 알아가는 일과는 다르다. 나는 내 감정과 이십몇년간 함께해왔지만 위에 서술한 대로 잘 알지 못한다. 슬프고 눈물은 나지만, 이게 내가 눈물날 사실인지 끝없이 의문이 든다. 그것에 슬픔을 느끼는 나에게 괴리감을 느끼면 곧 실망함과 서러움이 밀려든다. 슬픔과 우울함에 대한 내성이 있을까. 있다면 나는 그 내성이 얇다못해 가느다란 설탕층마냥 부서지기 쉬울테다. 한 번 슬픔이 밀어닥치면 그 충동을 이기지 못하겠다. 몸을 움직일 기운이 사라지고, 이 감정의 근원은 몰라도 이 감정을 내게 일렁인 사람은 알기때문에 그에게 미운 감정을 같게된다. 곪아버린 나를 그 사람에게 내보이며 동정받고 싶다. 그에게 죄책감을 심어, 그것을 내 보상으로 삼고 싶다. 내 이야기를 듣고 피곤할 사람에 대한 걱정을 먼저하지 않고 싶다. 사람과 함께 살기위해서는 그래야하겠지만, 마땅한 자세이겠지만, 많은 사람은 그러지 않는것 같기도 하고. 몰랐던 일이었지만 억지를 부렸다고 혼났다. 아빠가 그 이야기를 몇 번 했지. 나와 아빠가 보고있던 관점도 다르고. 아냐. 내가 산만했던게 맞다. 분명 내가 잘못했을 것이다. 그럼에도 너무 아프고 힘들어 눈물이 나고 목이 메였다. 이번에는 목소리를 잘 감춘걸까 싶다. 제대로 못 감춘듯 하다. 들키고 싶으나 들키고 싶지 않다. 나는 매정해지고 싶다. 누구에게도 상처받지 않는 단단한 심장과 차가운 머리가 나의 것이었으면 좋겠다. 인형과도 같이 당당하고 무기력하게 대응했으면 좋겠다. 감정에 휘둘리는 것은 나도 바라지 않는 일이건데, 인간은 이토록 비효율적으로 움직인다. 내가 가지고 있는 인형의 삶이 어떨지는 모르나, 분명 나보다는 나은 삶일 것이다. 이 감정을 누군가에게 옮기는 일이 죄악으로 느껴지는 내가 싫다. 그래서 결국은 아무에게도 이야기하지 못하고 곪아가 터져 죽을 것이다.",내가 슬퍼할만한 일이란 감정을 미확인 생물체마냥 멀고 어렵고 미지의 대상으로 느끼는 것이다. 슬픔과 우울함에 대한 내성이 있다면 나에게 괴리감을 느끼면 실망함 및 설움이밀려든다.
21,F,2019년 07월 01일,20190000,"오늘은 첫 실습날 ! 너무 떨려서 전 날 잠이 안왔다. 긴장을 풀려고 '스타듀밸리'라는 게임을 5시간정도 했다. 스듀는 너무 재밌는 게임인것 같다. 프로그램 설정을 살짝 바꿔서 캐릭터들의 얼굴들을 모두 내 취향으로 바꿨다. 너무 짱이다 ! 확실히 게임은 보는것보다 직접 하는게 더 재밌다. 농장도 내 맘대로 꾸미고, 계절별로 작물을 심는것도 다르고, NPC들과 호감을 쌓으면서 이벤트를 보는것도 아무튼 모두 다 재밌다. 근데 돈이 많았으면 좋겠다. 집도 넓히고, 가축도 더 기르고, 무기도 좋은걸 사야 좋은 아이템들을 많이 얻을 수 있기 때문이다. 아무튼 실습 첫날이라 그런지 쉬는시간이 무척 많았다. 근데 집에서 기관까지 거리가 거리인만큼 오전 6시에 일어나는게 무척이나 죽을맛이다. 누가 나 좀 살려줬으면 좋겠다. 심지어 오늘은 날씨가 너무 습해서 앞머리 볼륨이 다 죽었다. 나는 반곱슬 머리라서 머리 전체가 붕붕 떠다녔다. 하루 빨리 미용실에 가서 머리를 해야 겠다는 생각이 들었다. 앞머리가 더 길어지니까 볼륨도 잘 안살았다. 앞머리도 얼른 잘라야겠다. 실습을 하면서 실습일지를 매일 써야한다는 사실을 알게되었다. 나는 미루기가 내 일상이 되었었는데 절대 미루면 안된다는 생각 때문인지 집에 와서 라면이랑 참치김밥을 후딱 먹고 실습일지를 바로 쓴 다음 제출했더니 마음이 엄청 편안해졌다. 역시 미루지 않는것이 제일 좋은것같다. 기관에 계신 선생님들은 정말 친절하시고 좋았다. 센터를 이용하시는 어르신들도 좋고... 음 그래도 실습은 빨리 끝났으면 좋겠다. 집에서 너무 멀다. 힘들어... 퇴근을 하고 집에 가는길에 다이소를 들렀는데 와 내가 좋아하는 캐릭터 상품이 새로 나왔더라. 바로바로 토이스토리 ! 알린 보냉병이랑 컵이 무척 갖고싶었는데 욕심을 버리고 덧신,A4용지, 알린 필통, 알린 볼펜 등등 필요한것만 샀다. 만족스럽긴 한데 그 중에 제일 필요한 손세정제를 안샀다. 이런 내일 퇴근하면서 꼭 사야겠다. 그래도 내 방에 알린 상품들이 많아져서 기분이 좋다. 지금도 알린 볼펜으로 일기를 쓰고 있다. 내일은 기관에서 어떤 일들이 생길까. 한달동안 많은것을 배우고 갔으면 좋겠다.",첫 실습날 스듀밸리라는 게임을 5시간 정도 했는데 보는것보다 직접 하는게 더 재미있다. 농장도 내 맘대로 꾸미고 계절별로 작물을심고 NPC들과 호감을쌓으면서 이벤트를 보는데 모두 다 재밌고 돈이 많았으면 좋겠다.
21,F,바다여행 ,20200000,"2월 5일. 가족과 함께 바닷가에 다녀왔습니다. 이번 겨울 방학에는 어디에도 여행을 다녀오지 못했으니, 가볍게 드라이브라도 다녀오자는 어머니의 제안에 바닷가에 다녀오자고 내가 제안했기 때문입니다. 어머니께선 바다 구경보다는 먹거리에 더 관심이 많으셨기 때문에, 장소를 정하신 이후 그 근방의 유명한 맛집들부터 찾아보신 모양이셨습니다. 드라이브를 하러 가기로 한 날 당일, 어머니의 제안에 따라 보령시에 있는 바닷가로 향했습니다. 바닷가를 보러 가기도 전부터 먼저 점심을 먹으러 가자는 제안에 어머니께서 찾아두신 가게로 향했습니다. 굴을 중심으로 파는 가게였는데, 저희가 시킨 것은 굴구이와 굴찜으로 가격은 도시에 비해 꽤 싼 편이었는데 무척이나 양이 많았습니다. 네 사람이 다 먹지도 못할 정도로요. 물론 중간에 굴라면, 굴 칼국수를 시키긴 했었지만 그걸 시키지 않았더라도 다 먹었으리라 자신할 수 없을 정도로 양이 많았습니다. 점심은 자주 먹는 편이 아니어서 먹다 보니 금방 배가 불렀는데, 계속해서 굴을 까주시는 바람에 속도를 천천히 늦춰서라도 결국은 어찌어찌 다 먹었습니다. 배가 부르고, 그만 주셨으면 좋겠다 싶기도 했지만 드시지도 않고 제게 까주시는 게 무척이나 기쁘고 감사했으니까요. 그 후에는 함께 앞에 있던 바다를 보러 갔습니다. 비록 해안가는 아니었지만, 그래도 눈앞에서 바다를 볼 수 있다는 게 무척이나 기뻤었습니다. 마침 날이 좋아 하늘도 구름 한 점 없이 새파랗고, 그 하늘 아래 바다가 너무나도 아름다웠습니다. 요즈음은 바닷물이 그렇게 맑거나 깨끗하지 않은 곳이 많은데, 그곳은 바다가 너무나도 맑고 깨끗했습니다. 푸른 물결이 요동치고, 끝이 보이지 않을 정도로 넓은 바다가 너무나도 좋았습니다. 평생 잊고 싶지 않은 광경이었습니다. 당시 나는 동생과 함께 바다를 구경하고 있었는데, 동생이 옆에서 우스꽝스러운 말을 하는 것도 무척이나 즐거웠습니다. 동생은 막장 드라마에서나 흔히 나올법한 장면을 혼자 1인 3역으로 연기하며 저를 웃게 해주었습니다. 구름 한 점 없이 푸르른 하늘과 새파란 바다, 귓가에 들리는 동생의 목소리와 웃음소리. 정말이지, 더없이 아름답고 행복한 풍경이었습니다. 날이 추웠던 탓에, 열심히 사진을 찍느라 손이 꽁꽁 얼어버렸지만 그런 것은 신경 쓰이지도 않을 정도로 행복했습니다. 다음에 또 가족과 함께 찾아가고 싶을 정도로. 물론 그곳이 아니더라도, 소중한 가족과 함께라면 어디든 즐거울 것입니다. 저는 바다를 좋아하는 편이어서 가능하면 바다면 좋겠지마는, 꼭 바다가 아니더라도 가족이 즐거워 할 수 있는 곳이면 어디든지 좋습니다. 매번 바다에 가고 싶다는 저의 요청에 어울려주는 가족들에게 감사한 마음도 있고, 미안한 마음도 있기 때문에 더욱 그렇습니다.",겨울 방학에는 어디에도 여행을 다녀오지 못했으니 가볍게 드라이브라도 다녀오자는 어머니의 제안에 따라 보령시에 있는 바닷가로 향했다.
25,F,2월 5일,20200000,이미 아이디어 쌓아둔 시나리오는 많은데 살 붙이는 거랑 이걸 실제로 플레이해보고 어느 부분이 부족한지 아는 과정이 너~~~무길다... 그리고 일부러 짧은 시날들만 뽑아서 쓰고 있긴 하지만 한 거에 비해 양은 적어서 책 언제 내나 싶음 ㅠㅠ.. 옛날에 사둔 표지가 확 와닿는 내취향도 아니라 의욕도 없어.. 돈을 넣어둔거니 일단 쓰긴 하겠지만^_ㅠ.. 테플은 또 어디서 구하지.. 지인한테 부탁한 테플 피드백이 너무너뭐무 안돌아와서 다른 분으로 구하고 싶은데 시날을 쓰고 있단걸 누구한테 더 알리기도 싫음,이미 아이디어 쌓아둔 시나리오는 많은데 실제로 플레이해보고 어느 부분이 부족한지 아는 과정은 너 무 길다. 짧은 시날들만 뽑아서 쓰고 있긴 하지만 한 거에 비해 양은 적어서 책 언제 내나 싶고 의욕도 없다.
36,F,"목적지 없이, 정차 없이 어딘가로 사라지고 싶다.",20200000,"떠나고 싶다. 여기가 아니었으면 좋겠다. 매일 두번 오전 오후 이력서 갱신 할 때마다 오는 진한 현타, 이력서 공개게시판에서 붙박이로 보는 놈들도 이제 내 이력서 제목을 외워서 안 보는 건가? 싶을 정도로 클릭수가 반의 반으로 토막나고 있다. 트위터에 구독 해놓고 보고 있는 원화가들이 최근에 퇴사했다는 트윗을 올린지 얼마 되지 않아 바로 취업했다고 올라오는 트윗을 올리는 것을 보게 되었을 때. 남과의 비교가 나를 잃는 지름길인 것을 알면서도 그렇게 하게 된다. 문제는 나와 내 포폴에 있다는 사실을 아는데 자꾸 외면하고 싶다. 원화가로 일 했던 게 요행이었나 싶다. 그만둔 회사에서 만났던 아트 팀장이 연봉동결 문제로 이직을 논하는 나에게 진지하게 했던 이야기... ""**씨가 갈 수 있는 곳이 많지 않을 것이다. 자신과 같은 기준으로 보는 ad가 별로 없다"" 라고 했던 얘기가 어디에도 불려지지 않는 지금 뼈저리게 다가온다. 런칭한 게임이 망했다는 이유로, 권고사직에 불응하고 남았다는 이유로, 4년차에도 중소업체 신입수준의 연봉을 받았고 그래서 더 악착같이 돈을 모아야 했다. 그래서 나름 벌이 수준을 생각하면 불가능 하다 싶은 저축을 해냈는데 이 경력의 의미는 딱 그정도 밖에 없나 싶다. 잔고 좀 만들어 준 의미? 몇년 후면 마흔인데 스펙도 뭣도 없고 가진 기술의 수준도 높아져 가는 업계 기준에 맞추는데 유의미한 도움이 안되고 있다. 그럴수록 나를 더 갈고 닦으라 하는데 나는 멘탈 병신이 된건지 더 싸울 의지를 끄집어 내지 못 하겠다. 이 행위를 계속 하는 것이 고통스러워서 미칠 것 같다. 고용센터에서 심리 상담사가 자기 딴에는 도움이 되라고(채찍질) 했던 이야기가 자꾸 나를 쫓아 온다. 40 넘으면 사무직은 힘들어요~ 라는? 아니 난 이미 사무직에 쓸 수 있는 스펙이 없다 시피한 상태인데 누가 그걸 모를까? 그림만 그렸고 기술직으로 취업했지 사무직에 관련된 스펙이나 자격증 어느 것도 없는데 내가 지금 상황에 일반 사무직으로 취업하기 어려울거라는 사실을 모를리가 없지 않은가 ㅠㅠ 그럼에도 불구하고 시시때때로 불쑥 저 거지같은 이야기가 자꾸 생각이난다. 어떻게 된게 재수가 없어서 인지 성인이 돼서 밥벌어 먹는 내내 최저시급 언저리를 오가는 인생이었다. 미묘한 차이라고 해봐야 4대 보험이 있었냐 아니냐 정도? 이력서를 올려봤자 연락은 오지 않고 너는 이제 사무직을 할 수 없을 나이에 진입하게 될거라는 소릴 듣고 있다. 이제 내 관절 갈아가며 먹고 살 직업 밖에 남지 않았다니 ㅎㅎ 낙관은 어떻게 찾아 먹어야 하는 거냐? 이 유니콘 같은 새끼, 지금 어떻게 헤쳐 나간다고 해도 매번 죽을 것 같을 거고 더 나이먹은 다음에 몇배로 힘들어질 이 짓을 얼마나 지속 할 수 있을까? 당장은 질질 짜면서 어찌저찌 버텨가며 살고 있지만 훗날 나이 더 먹은 후의 내 인생 마무리가 자연사가 아닐 것 같다는 우울한 확신이 든다.",이력서를 갱신할 때마다 오는 진한 현타와 클릭수가 반으로 토막나고 있다. 트위터에 구독 해놓고 보고 있는 원화가들이 퇴사했다는 트윗을 올린지 얼마 되지 않아 바로 취업했다고 올라오는 게시물을 보게 되었을 땐 남과의 비교가 나를잃는 지름길인 것을알면서도 그렇게 하게 된다.
