author_age,author_sex,title,text_date,sentence,sentence_summary
31,F,요리를 다시 시작하면서 옛 생각을 하다,20200000,"그간 행해왔던 나쁜 식습관으로 인해 건강이 안 좋아졌다. 쉽게 피로해지고 운동을 해도 시원치 않은것이 나도 나이를 먹은거 같다. 그래서 가장 기본적인 식습관을 고치려 요리를 다시 시작하기로 했다. 평소에 하던 요리라곤 간단히 먹을 수 있는 간편식품을 조리해 먹는것이 전부였다. 인스턴트를 구매해서 빠르게 먹고 치울 수 있는 끼니를 선호했다. 이제는 건강을 생각할 때가 되어 아주 오랜만에 다시 요리를 시작해보기로 결정했다. 요리를 워낙 오랫동안 하지 않아서, 무엇을 해야 할지 감이 잡히지 않아 유튜브와 네이버 검색으로 '초심자도 쉽게 할 수 있는' 종류의 요리를 찾아보았다. 학생들도 쉽게 할 수 있는게 카레여서 카레를 해 보기로 결정했다. 카레에 필요한 식료품들을 구매해 온 후, 바로 조리를 시작했다. 감자와 양파는 물에 씻은 후 껍데기를 살짝 져며내어 깔끔하게 만들었다. 그 후 햄과 고기, 감자, 양파를 아이들이 먹는 깍두기마냥 네모낳게 작게 썰어 팬에 넣고 볶았다. 볶으면서 기름을 천천히 넣고, 올리고당과 함께 마늘 다진것도 넣어줬다. 그리고 카레 가루에 물을 넣어 수저로 천천히 저어서 카레물을 개어 냈다. 환기 시키면서 요리를 하느라 창문을 열어놓고 볶았는데, 생각보다 추워서 싫었다. 눈이 오진 않았지만 쌀쌀맞으며 교묘한 찬바람 때문에 성가심을 느꼈다. 요리를 하면서 몸도 추우니 옛 생각이 나서 잠시 서글퍼졌다. 네 가족이 모두 모여 함께 식사를 한게 언제인지… 10년은 더 된것 같아 가족들의 정이 그리워졌다. 어머니는 나와 함께 있고, 동생은 언제든 연락할 수 있는 상황이었지만 아버지는 그렇지 않다. 나의 아버지는 편협하고 자신만이 최우선인 인간이었지만, 때때로 인간적인 면모를 우리에게 보여줘서 좋은 추억들을 만들게 해줬었다. 나쁜 기억도 있지만 좋은 기억들도 있어서 아버지가 다시 보고 싶어졌다. 아버지 생각을 하면서 요리를 하다니, 나도 참 청승이다. 겨울의 마지막자락이 얼마 남지 않아서 그런것일까. 마음이 싱숭생숭해서 그런것일까. 요리의 결과는 나쁘지 않았다. 맛있었다. 하지만 아버지 생각을 하면서 채소를 볶아서 그런 것일까. 오랜만에 시도한 요리에서는 씁쓸하고 서러운 눈물과 슬픔의 맛이 났다.",그동안 행해왔던 나쁜 식습관으로 인해 건강이 안 좋아졌고 쉽게 피로해지고 운동을 해도 시원치 않아 나이를 먹은 것 같다. 그래서 가장 기본적이고 쉬운 식생활을고 다시 시작하기로 했다.
20,F,2020 2/6 일기,20200000,"2020년 2월 6일 날씨 매우  몹시 춥다 못해서 얼어 죽을 거 같은 추위이다. 밖에 나갔다 왔더니 귀가 얼어있었는데 진짜 너무 이쁜 빨간색으로 그라데이션 되어 있어서 뭔가 흡족했다. 사진찍어둘 걸 아쉽다. 뫄모씨 방년 2n세 2020년이 되고나서 대학교 n학년이 되어버린 예비 취준생이다. 넘나 슬프다. 내가 무슨 부귀영화를 누리겠다고 종강하고 나서 특별학기 신청해서 방학동안에 열심히 학교를 다니고 있을까. 정말 눈물이 다난다. 눈물 뚝뚝 눈물 뚝. 주르륵 눈물이 흘러버려요, 거기다가 1교시 수업이라서 무슨일 없으면 점심에 일어나서 하루 두끼만 먹던 사람이 오전 6시부터 일어난다. 정말 놀라워. 대단해 나. 칭창해 나. 이번 특별학기는 복수전공 +학과 사업단 관련된건데 진짜 전공은 잘 골라야 해요 여러분. 전기과 과목듣는데 너무 재미가 없어. 너무너무너무 재미가 없어서 저번주는 계속 졸다가 중간고사 망치고, 이번주에도 계속 졸다가 오늘 하루만 안 졸았다. 사람은 저작작용과 혀의 감각 작용이 계속 되어야 정신이 깨는 동물인걸 알게 되었다. 그니까 내일부터 카라멜 마끼야또 사가야지. 다이어트 하고있는데 어쩔수 없는걸, 공부가 더 중요하니까. 나는 진지하다. 정말이다. 사실 2020년부터 일기 써보려고 다이어리 샀는데 하나도 안썼다. 그렇게 1월이 사라져버렸네? 근데 노트북으로 쓰니까 엄청 잘 써진다. 앞으로 여기다가 쓰고 프린트해서 붙여야겠다. 사실 수업시간에 안 졸기는 했는데 너무 재미도 희망도 없으니까 저절로 멍이 때려졌다. 진짜 정신 차리니까 수업시간이 뿅 사라져버림. 이럴거면 깨어있는 것도 보람이 없지 않을까 라는 생각이 살짝 쿵 들었는데. 괜찮아 앞으로 잘하면 되지. 역시 사람은 배움의 동물이다.  쨋든 멍때리는 동안에 타로카드 문양 생각했는데 너무 이뻐서 혼자 실실거리면서 웃었던거 생각난다. 뭔가 교수님이랑 눈 마주쳤었는데, 교수님 전 그런사람이 아닙니다. 진짜에요. 아 교수님 하니까 중간고사 시험지 내고 뿌듯해서 나가려는데 교수님이 엄청 심각한 표정으로 내 답안지 본거 생각나네.. 그런 사람인거 같습니다. 그냥 그런 사람 할게요.",2020년 2월 6일 날씨 몹시 춥다 못해 얼어 죽을 거 같은 추위이다. 밖에 나갔다 왔더니 귀가 얼었는데 너무 이쁜 빨간색으로 그라데이션 되어 있어서 뭔가 흡족했다.
20,F,2013년도의 일기,20130000,"생각해보면, 나는 대학교 시절의 소설을 쓴 적이 없다. 내가 지금 대학생임에도 불구하고. 항상 20대 후반, 30대 초반의 이야기를 쓴다. 어쩌면 대학생인 주인공의 마음을 내가 가장 잘 이해할텐데. 그런데 어쩌면 내가 가장 잘 알기에, 이 삶의 환상이 없어 쓰지 않는 것이 아닐까. 얼마 전에 손을 다쳤다. 꽤 피가 많이 나 병원에 갔었는데, 이제 통증도 많이 나았고 한번쯤은 상처를 엿봐도 될 법한데. 무언가 보기 무서웠다. 어렸을 적에는, 내 상처를 보는 것을 무서워하지 않았는데. 나이가 들수록 내 상처를 두려워한다. 상처 앞에 서길 망설인다. 가끔 버스 차창에 시선을 둔다. 많은 사람들이 말하는 '화려한 네온사인' 이란 수식어보단, 가슴을 물들게 하는 빛들의 향연 같은 느낌이다, 나에겐. 오늘도 난 마음 속의 수채화를 그려나간다. 나는 모든 것에 시들해지는 내가 무섭다. 열정도, 열망도, 희망도, 설렘도....없는 내가 무섭다. 한 떨기의 꽃처럼 메말라가고 있다. 나는.... 정말 창 밖을 보며 울 뻔했다. 정말 버스 안에서 울 뻔했다. 하필 노래가 왜이리 슬픈거야...하지만 노래를 멈추지 않았다. 노래제목처럼, 먹지에 감정이 스며들게...그냥 놔두었다. 그렇게 하는 것이, 좋을 것 같다고...난 그리 생각했다. 사람은 삶의  무게에세 벗어나지 못한다. 그렇지만 삶의 무게는 변화하기도 하는 것이다. 몇 년 전, 내 삶의 무게는 무겁지 않느냐고 스스로 물었다. 하지만 무겁지 않았다. 희망이라는 끈이 내 삶의 무게를 들어주고 있었으니까. 덜어주고 있었으니까. 지금은? 삶의 무게를 꾸역꾸역 지고 체념하고 있다. 어깨가 통증을 호소하고, 허리가 비틀린 듯 아프고,다리가 흔들린다. 그렇지만 그 무게를 갖고 가야함을, 난 알고있다. 무려 2년 반동안 썼던 필통이다. 망가졌어도 버리지 못하겠고 안 쓸수가 없다. 새로운 것이 있어도, 이것만큼 편하고 예쁜게 없더라. 그래서 망가진 것을 계속 가지고 다니고 있다. 난 변화가 필요했던 것 같다. 난 배움이 필요했던 것 같다. 난 ""다시 시작""이 필요했던 것 같다. 그래 다시 시작하자.",나는 대학교 시절의 소설을 쓴 적이 없다. 내가 대학생임에도 불구하고 항상 20대 후반 30대의 이야기를 쓰고 있는데 아마 주인공인 나를가장 잘 이해하기 때문일 것이다.
20,F,제목 없음,20200000,"나는 대한민국의 생물학적 여성이다. 그리고 이 나라는 여성을 너무나도 싫어하는 것 같다고 나는 느낀다. 최근 코로나 바이러스 확진자들에 대한 사람들이 반응만 봐도 확연하게 다르다. 3번째 확진자는 자신이 우한을 다녀왔고 열이 났음에도 불구하고 해열제를 먹어가면서 사람이 많다고 알려진 강남을 돌아다니며 며칠 간 신고를 하지 않아 3차, 4차 감염자까지 일으켰다. 그러나 이 남성에 대해 동선을 빼고 알고 있는 정보가 있나? 이 3번째 확진자는 결국 2차 감염으로 6번째 확진자를 만들었는데 이 6번째 확진자의 딸은 아버지와의 식사를 하고 감염자 취급을 받고 또한 이 여성이 어린이집 교사라는 이유로 맘카페 등에서 신상을 털려 많은 사람에게 욕을 먹었다. 왜 이 여성이 신상을 털려야 하는지 나는 도저히 생각해봐도 이유를 알 수가 없다. 굳이 신상이 털려야한다면 3번째 확진자의 신상이 털려야하지 않나. 사람들이 여성을 싫어한다고 느껴지는 사건은 이 뿐만 아니다. 누드모델남의 불법촬영한 여성은 포토라인까지 섰으며 징역살이을 하고 있는데 몇 달 전부터 이슈화된 n번방 사건은 아직도 현재 진행 중이다. 또한 이 n번방 사건은 여러 sns에서나 이슈화 됐지 실제 뉴스에서 크게 다뤄진적은 없다. 심지어 n번방 사건의 실체를 보고 신고를 한 남성은 경찰들이 제대로 사건을 처리해주지 않자 이런 범죄를 저질러도 문제 없다고 생각하고 자신이 주도자가 되어 n번방 사건에 가담했다고 한다. 가해자가 여성일 때와 남성일 때 경찰들의 태도와 사건에 대한 중함이 달라진다고 나는 생각한다. 여성은 도대체 남성과 무엇이 다르기에 고용차별, 임금차별 등의 각종 성차별을 당하여야 하는가. 성별이 다르다는 것 이외에 도대체 무엇이 다른가? 결국에는 똑같은 사람이지 않은가. 대한민국 전체에 퍼진 여성혐오에 대한 문제를 해결하지 못하면 나라는 이대로 망할 것이다. 실제로 출생율은 점점 떨어져 0.6퍼센트가 되었고 많은 여성들이 결혼을 하지 않는 비혼주의를 선택하고 있다. 여성이 남성과 동등해지는 그날을 위해 나는 오늘도 살아간다.",대한민국의 생물학적 여성인 나는 코로나 바이러스 확진자들에 대한 반응만 봐도 확연하게 다르다. 3번째는 우한을 다녀왔고 열이 났음에도 불구하고 해열제를 먹어가면서 사람들이 많다고 알려진 강남에서 며칠 간 신고하지 않아 4차 감염자까지 일으켰지만 그 남성은 n번방 사건 등 여러 sns에서나 이슈화 됐었지만 실제 뉴스에서는 크게 다뤄진 적은 없다.
23,F,유럽여행 계획 말한 날 ,20160000,"엄마랑 단둘이 돈까스 먹으러갔다가 막연한 내 계획을 말했다. 내가 빌려준 1,000만원 갚는대신에 유럽여행 갔다와서 버는 돈의 일부를 집에 주겠다고 합의했다. 남는 돈으로 가족여행도 가겠다고 돈이 남으면 말이야 하하 내가 빌려줬던 1,000만원은 대학교 휴학하고 피땀눈물 흘려가며 벌었는데 학비내기전에 돌려준다고 엄마가 빌려갔었다. 막상 대학교를 들어가자 일하다가 공부하려니까 너무 재밌더라, 그래서 장학금을 받았는데 졸업한지 일년이 지난 지금까지 타이밍을 놓여 받지 못했다. 난 많이 지쳐있었고 학과 관련 첫 직장에 들어갔다가 퇴사하고 백수생활을 즐기고 있었다. 막연한 계획 뿐이였는데 엄마한테 말하고나서 확신이 생겼다. 사실 나는 해외에 별로 관심이 없었다. 영어를 정말 못하기도 하고 영어에 관심이 없기도 했다. 한글만 읽고 쓸줄 알면 그뿐이라 생각했고 장난스레 그렇게 말하고 다녔었다.  근데 문득 그런생각이 들더라. 지금 아니면 안될 것 같았다. 사실 빌려 준 돈을 못받을꺼라고 생각했고 이렇게 지내다가 다시 이직하면 몇년동안 사무실에 앉아 있어야 한다는게 너무 끔찍하단 생각이 들었고 조급해졌다. 당장 가야겠다고 생각했다. 지금이 제격이라고 그렇게 여행일정을 밤새 잠도 안자고 엑셀을 켜 써내려갔다. 대충 가고싶은 나라 틀만 잡아놓고 아빠한테 밥먹다가 유럽여행에 대해 말했다. 내 딸 도전정신있다고 힘이 되어줬다. 지금은 그게 제일 고민이다 10~11월에 여행을 갈지 11월 중순~1월초에 갈지 거기서 크리스마스랑 새해 보내면 개 좋을꺼 같긴한데 미친 생각해보니까 너무좋다. 이미 일기 쓰면서 맘은 기운듯하다 나는 아마 여름에도 또 갈것같다 나의 25~26살은 여행으로 가득채우고싶다. 물론 유럽여행 다녀와서 취업도 해야겠지 약속지켜야지 아메리칸투어리페어 캐리어도 샀고 해외수수료1%라는 카드도 만들었다. 아, 카드 안만들어주면 어떡하지 그래도 나는 마스터카드랑 유...어쩌구 있긴한데 비자 있어야 될것같단말이야... 환전도 유럽화폐 유로랑 영국화폐 파운드 스위스화폐 프랑도 해야하는데 얼마할지가 너무 고민된다. 그래도 내 마음의 인 아웃은 정했다. 런던in - 로마out 인아웃을 정하는게 여행 계획의 1순위지. 내가 현재 제일 기대되는 나라는 런던, 파리, 로마다. 겨울엔 스위스가 짱일것같기도 한데 아 설렌다... 어떡해...",나는 해외에 별로 관심이 없었고 영어를 못하기도 했다. 하지만 지금 아니면 안될 것 같아 당장 가야겠다고 생각했고 여행 계획의 1순위는 런던in 로마out 인아웃으로 정했다.
20,F,새벽 오리온자리,20190000,"과제를 수정하다가 바닥에 엎드린 채 잠이 들고 말았다. 그러다 새벽 2시 반에 문득 잠이 깼다. 그게 푹신한 침대 위에 올라가 자라는 몸의 비명이었는지, 환하게 떠오른 심야의 별을 보라는 운명의 신호였는지 모르겠다. 아마 후자이겠거니 싶다. 그쪽이 좀 더 낭만적이고 뭉클하니까. 침대 머리맡 창문 너머로 푸른 기가 도는 짙은 밤이 펼쳐져 있다. 밤은 생각처럼 검지 않다. 때로는 거짓말처럼 환해 보이는 남색이기도 하고, 구름이 낮처럼 희게 보이기도 하고, 탁하고 누런 빛깔이 돌기도 한다. 이날의 밤은 짙은 남색에 가까웠고, 그런 도화지에서는 유독 작고 하얀 점이 빛나기 마련이다. 새벽 2시 반의 하늘에 오리온자리가 반짝이고 있었다. 나는 세상 많고 많은 별자리 중에 오직 오리온자리만을 금방 찾아낼 수 있다. 중학교 때인가, 고등학교 때인가, 과학 선생님꼐서 방학에 해외 옇애을 가서 사막의 밤하늘을 보았다며 사진을 자랑하신 일이 있었다. 아마 거기가 터키였던가. 그때부터 언젠가 사막에서 하룻밤을 자 보고 싶다고 생각했는데. 어쨌든 그 과학 선생님께서 오리온자리를 보는 방법을 알려주셨다. 반짝거리는 별이 연이어 셋 있는 곳을 찾으면 나머지는 금방 찾을 수 있다고. 우리가 볼 수 있는 밤하늘에서 오직 오리온자리만이 그리 가깝게 붙어 줄지어 있다고. 그 뒤로 오리온자리는 내가 읽을 수 있는 별자리가 되었다. 하늘을 올려다보며 아는 별을 찾을 수 있다는 것은 그 자체로 가슴 벅차는 일이다. 요즘은 여기에 더불어 동생 생각도 한다. 동생은 별자리를 얼마든 외우고 또 찾아낼 수 있으니까, 걔가 보는 밤하늘은 내 것보다 더 반짝이고 있겠지 하는 것을.",나는 세상 많고 많은 별자리 중에 오직 오리온자리만을 금방 찾아낼 수 있다. 중학교 때 과학 선생님께 사막의 밤하늘을 보았다고 자랑했던 일이 있었는데 그 이후로 내가 읽을 수도 있게 되었다.
26,F,건강검진,20200000,"성인이 된지 처음으로 건강검진을 받으러 갔다. 학창시절 때 반 친구들과 함께 받던 건강검진과 사뭇 느낌이 달랐다. 문진표를 작성한 뒤 검진복으로 환복해야 했는데 역시나 분홍색이었다. 아마 일반 검진이라 그랬던 것 같고 옷색에 따라 받는 검진의 종류가 달라보였다. 건물의 대부분이 건강검진을 위한 건물인 만큼 과정은 가히 공장처럼 돌아갔다. 내 이름이 적힌 파일 홀더가 여러 손을 거치면서 나를 호명했다. 키, 몸무게, 시력, 혈압, 혈액, 초음파 등 컨베이너 벨트처럼 돌아가는 수많은 직원들 사이에서 나는 그저 그 위에 놓여진 제품과도 같았다. 처음에는 어색했으나 건강검진 센터에 도착한지 1시간 반쯤 지났을 때 나도 직원들과 거의 유사한 표정으로 자연스럽게 눕고 직원의 안내대로 몸을 움직였다. 생각보다 수면 내시경도 별탈없이 잘 끝났으나 마취가 풀리는 데에 오래 걸린 건지 아침 일찍부터 움직이느라 부족했던 잠이 몰려오는 건지 마지막 검진을 남기고서 자꾸만 눈꺼풀이 무거워졌다. 결과는 2주 뒤에 나온다는데 한 열흘쯤 지나면 나오지 않을까 기대해본다.",성인이 된 후 처음으로 건강검진을 받았는데 학창시절 때 반 친구들과 함께 받던 것과는 다르게 옷색에 따라 받는 검진의 종류가 달라보였다. 건물 대부분은 병원인 만큼 직원들 사이에서 제품과도 같았고 긴장한 탓인지 수면 내시경도 별 탈 없이 잘 끝났으나 눈꺼풀이 무거워졌고 결과는 열흘쯤 지나면 나오지 않을까 기대해본다.
30,F,일상과 친구,20200000,"추운 날이다. 평소 같으면 침대에서 이불이랑 얽혀있을 시간이지만, 무거운 몸을 이끌고 욕실로 향했다. 오늘은 모처럼 대학교 동기들과 만나는 날이기 때문이다. 매일 메신저로 쓸데없는 잡담을 하며 하루의 시작과 끝을 보내는 사이지만, 이렇게 다 같이 만날 수 있는 날은 드물기 때문에 답지 않게 조금 설레기도 했다. 씻고 난 뒤 수분 크림으로 촉촉이 적신 얼굴에 익숙하지 않은 분칠을 하고 옷장 앞에 서서 고민을 한다. 두툼한 롱패딩과 얇지만 멋내기에 좋은 코트를 양쪽 손에 쥐고 저울질을 했다. 모처럼의 만남인데 춥더라도 코트를 입어야 하나, 아니면 모양은 좀 그렇지만 따뜻하고 편안한 패딩을 입어야하나. 한참을 씨름한 끝에 결국에는 패딩을 입기로 결정하였다. 어차피 친구사이인데 편하게 입어도 괜찮겠지 싶었기 때문이기도 했다. 그러나 현관을 떠나 지하철로 향하면서도 계속 코트가 머리 한편에서 맴돌았다. 일 년에 한 번. 게다가 오늘은 친구 한 명의 결혼을 축하하기 위한 자리이기도 했는데, 너무 편하게 입었나 싶어서 괜히 마음이 조금 불편해졌다. 정작 친구는 별로 신경쓰지도 않을 사소한 일을 혼자 이렇게 속상해한다. 가끔 그런 날이 있다. 남들이 보면 별 것도 아닌 사소한 일이 내 하루를 좌우하는 날. 오늘 역시 그런 날인 듯 싶었다. 이제는 돌이킬 수도 없는 부질없는 선택을 곱씹으면서 약속 장소로 향했다. 도착한 곳은 온갖 사람들이 모인다는 서울의 번화가답게 사람들이 많았다. 게다가 오늘은 주말이라 그런지 더욱 많은 것 같았다. 나는 애써 사람들 무리를 헤치며, 미리 검색해 둔 지도와 주변 건물들을 눈으로 훑으며 약속 장소를 찾았다. 그 와중에도 메신저는 쉬지 않고 친구들이 재잘재잘 떠들고 있음을 알렸다. 누구는 벌써 도착했고, 누구는 아직 버스 안이고, 누구는 갑자기 일이 생겨 약속 시간보다 늦을 예정이라고 했다. 오늘은 날이 너무 춥다느니 또 무슨 음료를 마시고 싶다느니 하는 사소한 잡담들도 오갔다. 곧 만날 것임에도 우리는 이렇게 잡다하다. 이렇게 매일 일상을 얘기하는 사이인데도 매일 또 새로운 대화의 내용이 형성된다. 그만큼 익숙하면서도 그만큼 낯설다. 10년을 만나는 관계인데도 그렇다. 가끔 이 관계가 지루하다고 느끼면서도 또 설레는 것과도 같다. 그래서 나는, 그리고 우리는. 내일 그리고 그 다음 10년을 기대하는 것일지도 모른다. 나는 설렘을 가득 품고 약속한 장소의 문을 열었다. 그리고 그 곳에 내 정겨운 익숙함들이 있었다.",메신저로 쓸데없는 잡담을 하며 하루의 시작과 끝을 보내는 사이지만 이렇게 다 같이 만날 수 있는 날은 드물기 때문에 답지 않게 조금 설레기도 했다.
19,F,실습 이야기,20200000,"1월 2일부터 실습을 나갔다. 실습을 나간 이유는 교수님께서 적은 돈을 받더라도 한 번 경험해보는 게 좋을 것 같다고 추천해주셨기 때문이다. 그리고 동계 계절학기 학점 3학점을 주기 때문에 실습을 신청했다. 첫 날, 회사의 위치를 잘못 찾아갔다. 도착하고 이곳이 아는 것 같은데 인터넷에서 이 곳이라고 해서 도착했다고 전화를 했다. 전화를 한 지 시간이 좀 지났는데도 아무도 안 나와서 잘못됐다는 것을 깨달았다. 그래서 급히 건물을 나가 다시 건물을 찾았다. 첫날부터 실수를 해 약간의 자책을 했다. 그래도 지각을 하지 않아 다행이라고 생각했다. 실습 기간은 한 달이다. 실습하는 동안 업무에 관해 많이 배웠다. 학교에서 배운 이론들은 시험을 위해 무작정 외워 이해가 잘 되지 않았는데 회사에 나가 실습을 하는 동안 내가 시험을 위해 암기한 것들을 응용해서 쓸 수 있었다. 뿌듯하고 성취감이 느껴졌다. 실습하는 동안 지각을 하지 않는 것이 나의 목표였다. 하루는 아슬아슬하게 도착했지만 결론적으로 지각하지 않았다. 한 달 동안 지각하지 않고 실습을 무사히 마친 것에 대해 뿌듯하다고 느꼈다. 실습기관의 직원분들께서 모두 친절하셨다. 모르겠다고 느낀 내용을 물어보면 바로바로 친절하게 알려주셨다. 긴가민가하게 마친 일들에 대해 이렇게 하는 게 맞냐 물으면 맞다고 잘했다고 칭찬해주셔서 좋았고 더욱 열심히 일을 했다. 실습 마지막 날은 실감이 나지 않았다. 한 달 동안 일찍 일어나 준비하는 게 힘들었다. 이제 일찍 일어나지 않아도 되고 지하철을 탈 필요가 없어졌다는 것이 조금은 어색하게 느껴졌다. 대리님, 주임님, 선배님, 사무장님과 마지막 인사를 하는데 아쉬움이 느껴졌다. 다들 한 달간 정말 많이 도와주셨고 짧다면 짧고 길다면 긴 시간동안 정이 많이 들었기 때문이다. 대리님께서는 문 앞까지 배웅해주셨다. 집으로 가는 지하철에서는 그냥 퇴근하는 기분이 들었다. 실감이 나지 않았던 것이다. 하지만 지하철에서 내리고 집으로 가는 길에 그런 생각이 들었다. '아, 졸업식 끝나고 집 가는 기분이다.' 졸업도 순간에는 실감이 나지 않다가 끝나고 집 가는 길에 나의 학교생활이 끝났다는 게 실감이 나기 때문이다. 섭섭하면서도 아쉬웠던 실습이었다.",실습을 나간 이유는 교수님의 추천으로 한 번 경험해보는 게 좋을 것 같다고 권유해 있었기 때문이다. 실습 기간 동안 업무에 관해 많이 배웠고 학교에서 배운 이론들은 무작정 외워 이해가 잘 되지 않았는데 회사에나가 시험을위해 암기한것들을 응용해서 쓸 수 있어서 뿌듯하고 성취감이 느껴졌다.
